{
  "$schema": "../../schemas/v1.7.1-v1.2-evidence-intake-plan.schema.json",
  "schemaVersion": 1,
  "planId": "goreecloud.glaze.v1.7.1.v1.2-evidence-intake",
  "name": "Glaze V1.7.1 Retained V1.2 Governed Evidence Intake Plan",
  "lifecycle": "DevelopmentQualification",
  "successorReleaseLine": "1.7.1",
  "developmentIdentity": "1.7.1-dev.1",
  "sourceRevision": "4b9d085a5177b96cc31d4270b38d792a59872e37",
  "sourceModelVersion": "1.7.0-dev.47",
  "acceptanceModelVersion": "1.7.0-dev.39",
  "stableBaseline": "1.7.0",
  "historicalSourceStableBaseline": "1.6.0",
  "consumerEligible": false,
  "retainedLaneCount": 37,
  "evidenceTypes": [
    "machine",
    "rendered",
    "device",
    "human",
    "assistive-technology",
    "performance",
    "energy",
    "provenance"
  ],
  "conditionalLaneIds": [
    "wearable",
    "energy-behavior"
  ],
  "retainedBaseline": {
    "workingSetPlan": "contracts/v1.7/qualification.v1.2.working-set.plan.json",
    "durableRegressionEvidence": "acceptance/v1.7.1-regression-evidence.json",
    "evidenceRecordCount": 44,
    "externallyVerifiedLaneCount": 17,
    "unverifiedLaneCount": 20,
    "evidenceGroupCompleteLaneIds": [
      "task-continuity",
      "adaptive-composition",
      "semantic-color",
      "theme-safety",
      "custom-theme-accessibility",
      "signature-motion",
      "connected-transformations",
      "animation-interruption",
      "animation-reversal",
      "reduced-motion",
      "reduced-transparency",
      "increased-contrast",
      "forced-colors",
      "large-text",
      "rtl",
      "regression",
      "artifact-provenance"
    ]
  },
  "intakeRules": {
    "exactSourceRevisionRequired": true,
    "exactToolingRevisionRequired": true,
    "contentAddressedEvidenceReferenceRequired": true,
    "candidateRecordAutomaticallyAccepted": false,
    "acceptedEvidenceRequiresGovernedReview": true,
    "partialReviewedEvidenceMayBeRecorded": true,
    "allRequiredGroupsNeededForInventoryComplete": true,
    "conditionalLaneRequiresSpecificJustificationWhenNotApplicable": true,
    "reviewedEvidenceMayPostdateObservation": true,
    "evidenceMayPostdatePacketReview": false,
    "retainedBaselineMayBeUsedForFrozenSource": true,
    "retainedBaselineAutomaticallyReboundToChangedCandidate": false,
    "controlCoverageEqualsEvidenceCoverage": false,
    "completeInventoryEqualsSection46Completion": false,
    "completeInventoryEqualsV171Acceptance": false
  },
  "referencePolicy": {
    "scheme": "evidence+sha256",
    "digest": "sha256-lowercase-hex-64",
    "locator": "credential-safe-repository-style-relative-logical-path",
    "absolutePathsAllowed": false,
    "parentTraversalAllowed": false,
    "credentialsAllowed": false,
    "unnecessaryPrivatePayloadAllowed": false
  },
  "reviewDecisionValues": [
    "not-reviewed",
    "reviewed-evidence-inventory"
  ],
  "implementation": {
    "packetTemplate": "acceptance/v1.7.1-v1.2-evidence-intake.template.json",
    "packetSchema": "schemas/v1.7.1-v1.2-evidence-intake.schema.json",
    "validator": "scripts/validate_glaze_v1_7_1_v1_2_evidence_intake.mjs",
    "workflow": ".github/workflows/glaze-v1.7.1-v1.2-evidence-intake-control.yml",
    "workingSetPlan": "contracts/v1.7/qualification.v1.2.working-set.plan.json",
    "workingSetAssembler": "scripts/assemble_glaze_v1_7_v1_2_qualification_working_set.mjs",
    "performanceControl": "contracts/v1.7/qualification.v1.2.performance.plan.json",
    "assistiveTechnologyControl": "contracts/v1.7/qualification.v1.2.assistive-technology.plan.json",
    "humanControl": "contracts/v1.7/qualification.v1.2.human.plan.json",
    "deviceControl": "contracts/v1.7/qualification.v1.2.device.plan.json",
    "energyControl": "contracts/v1.7/qualification.v1.2.energy.plan.json",
    "fieldHumanControl": "contracts/v1.7/qualification.v1.2.field-human.plan.json"
  },
  "currentBoundary": {
    "intakeControlEstablished": true,
    "retainedBaselineEvidenceRecordCount": 44,
    "retainedBaselineExternallyVerifiedLaneCount": 17,
    "retainedBaselineUnverifiedLaneCount": 20,
    "acceptedExternalEvidenceRecordCount": 0,
    "acceptedEvidenceInventoryComplete": false,
    "readyForGovernedQualificationReview": false,
    "section46Complete": false,
    "v171AcceptanceEstablished": false,
    "lifecyclePromotionEstablished": false,
    "consumerAcceptanceEstablished": false,
    "deploymentAcceptanceEstablished": false,
    "publicationEstablished": false,
    "productionAcceptanceEstablished": false
  },
  "boundary": "This intake plan governs durable admission of independently reviewed exact-source field evidence into the retained 37-lane v1.2 / dev.39 qualification matrix. The already established 44-record historical-source working set remains the frozen-source baseline at 17 evidence-group-complete lanes and 20 unverified lanes. New reviewed records may incrementally satisfy missing evidence groups, but control coverage, packet validity, or even a complete evidence inventory cannot itself complete Section 46, establish V1.7.1 acceptance, promote lifecycle state, grandfather downstream consumers, authorize deployment or publication, or establish production acceptance."
}
